source,target,type,tx_id,amount,id_qr,received,dispatched,comentario
wZdUpbkLNBK6bdpwoaChjaju18ctM3E6sb,wQT6EGz6G3guxYLjBNSg2u3XxCc9SDMvpk,SENDMOL,{{codigo_generado}},11552000,CO.COM.RED.TRXID1234567890123456789,{{fecha_actual_formato_iso}},{{fecha_actual_formato_iso}},Validar la funcionalidad de Liquidación de una instrucción de pago Inter-SPBVI caso de uso P2P
wZdUpbkLNBK6bdpwoaChjaju18ctM3E6sb,wQT6EGz6G3guxYLjBNSg2u3XxCc9SDMvpk,SENDMOL,{{codigo_generado}},11552000,CO.COM.RED.TRXID1234567890123456789,{{fecha_actual_formato_iso}},{{fecha_actual_formato_iso}},Validar la funcionalidad de campo (tx_id) con caracteres numericos
wZdUpbkLNBK6bdpwoaChjaju18ctM3E6sb,wQT6EGz6G3guxYLjBNSg2u3XxCc9SDMvpk,SENDMOL,{{codigo_generado}},11552000,CO.COM.RED.TRXID1234567890123456789,{{fecha_actual_formato_iso}},{{fecha_actual_formato_iso}},Validar la funcionalidad de campo (tx_id) formato correcto
wZdUpbkLNBK6bdpwoaChjaju18ctM3E6sb,wQT6EGz6G3guxYLjBNSg2u3XxCc9SDMvpk,SENDMOL,{{codigo_generado}},11552000,CO.COM.RED.TRXID1234567890123456789,{{fecha_actual_formato_iso}},{{fecha_actual_formato_iso}},Validar la funcionalidad de campo idqr formato correcto
wZdUpbkLNBK6bdpwoaChjaju18ctM3E6sb,wQT6EGz6G3guxYLjBNSg2u3XxCc9SDMvpk,SENDMOL,{{codigo_generado}},11552000,C,{{fecha_actual_formato_iso}},{{fecha_actual_formato_iso}},Validar la funcionalidad de campo idqr con 1 digito en el valor
wZdUpbkLNBK6bdpwoaChjaju18ctM3E6sb,wQT6EGz6G3guxYLjBNSg2u3XxCc9SDMvpk,SENDMOL,{{codigo_generado}},11552000,CO.COM.RED.TRXID1234567890123456789,{{fecha_actual_formato_iso}},{{fecha_actual_formato_iso}},Validar la funcionalidad de campo idqr con menos de 36 caracteres